{
  "invoice": {
    "id": "33333333-3333-4333-8333-333333333333",
    "organizationId": "11111111-1111-4111-8111-111111111111",
    "customerId": "22222222-2222-4222-8222-222222222222",
    "type": "invoice",
    "status": "draft",
    "number": null,
    "variableSymbol": null,
    "constantSymbol": null,
    "specificSymbol": null,
    "currency": "EUR",
    "issueDate": "2026-01-15",
    "deliveryDate": "2026-01-15",
    "taxPointDate": "2026-01-15",
    "dueDate": "2026-01-29",
    "paymentMethod": "bank_transfer",
    "vatMode": "payer",
    "language": "SK",
    "clientNote": "Dakujeme za spolupracu.",
    "internalNote": null,
    "issuedAt": null,
    "sentAt": null,
    "paidAt": null,
    "createdAt": "2026-01-15T10:00:00Z",
    "updatedAt": "2026-01-15T10:00:00Z"
  },
  "items": [
    {
      "id": "44444444-4444-4444-8444-444444444444",
      "description": "Konzultacne sluzby",
      "quantity": 1,
      "unit": "ks",
      "unitPriceNet": 100,
      "discountPercent": 0,
      "vatRateCode": "SK-23",
      "vatTreatmentCode": "domestic_goods_or_services",
      "businessCategoryId": null,
      "projectId": null,
      "costCenterId": null,
      "lineNet": 100,
      "lineVat": 23,
      "lineGross": 123
    }
  ],
  "totals": {
    "netTotal": 100,
    "vatTotal": 23,
    "grossTotal": 123,
    "allocatedPaymentsTotal": 0,
    "creditNotesTotal": 0,
    "remainingBalance": 123,
    "roundingDifference": 0
  },
  "issueSnapshot": null
}
